{
    "meta": {
        "name": "sanliou_zhenpinchuanshuo",
        "source": "https://pvp.qq.com/web201706/newsdetail.shtml?tid=801291",
        "game": "王者荣耀",
        "time": "2026_5_20",
        "cost_id": "sanliouqiyuanbi",
        "cost_name": "三丽鸥祈愿币",
        "amount": 6,
        "per_cost_to_rmb": 1
    },
    "initial": {
        "begin_pool": "begin_pool"
    },
    "items": {
        "sanliouduihuanbi": {
            "name": "三丽鸥兑换币"
        },
        "teshuhuizhangbaodijishu": {
            "name": "特殊徽章保底计数"
        },
        "teshuhuizhang1": {
            "name": "特殊徽章1"
        },
        "teshuhuizhang2": {
            "name": "特殊徽章2"
        },
        "teshuhuizhang3": {
            "name": "特殊徽章3"
        },
        "teshuhuizhang4": {
            "name": "特殊徽章4"
        },
        "yao_daergouzhimeng": {
            "name": "瑶_大耳狗之梦",
            "resolve": {
                "retain": 1,
                "actions": [
                    {
                        "type": "reduce_item",
                        "id": "yao_daergouzhimeng",
                        "amount": 1
                    },
                    {
                        "type": "add_item",
                        "id": "sanliouduihuanbi",
                        "amount": 198
                    }
                ]
            }
        },
        "anqila_kuluomizhixin": {
            "name": "安琪拉_酷洛米之心",
            "resolve": {
                "retain": 1,
                "actions": [
                    {
                        "type": "reduce_item",
                        "id": "anqila_kuluomizhixin",
                        "amount": 1
                    },
                    {
                        "type": "add_item",
                        "id": "sanliouduihuanbi",
                        "amount": 198
                    }
                ]
            }
        },
        "mianhuatangjuhuitianmu": {
            "name": "棉花糖聚会天幕",
            "resolve": {
                "retain": 1,
                "actions": [
                    {
                        "type": "reduce_item",
                        "id": "mianhuatangjuhuitianmu",
                        "amount": 1
                    },
                    {
                        "type": "add_item",
                        "id": "sanliouduihuanbi",
                        "amount": 168
                    }
                ]
            }
        },
        "lingbaozhuangban_kaidimaodetongqu":{
            "name":"灵宝装扮_凯蒂猫的童趣",
            "resolve": {
                "retain": 1,
                "actions": [
                    {
                        "type": "reduce_item",
                        "id": "lingbaozhuangban_kaidimaodetongqu",
                        "amount": 1
                    },
                    {
                        "type": "add_item",
                        "id": "sanliouduihuanbi",
                        "amount": 98
                    }
                ]
            }
        },
        "lingbaozhuangban_kuluomidewanpi":{
            "name":"灵宝装扮_酷洛米的顽皮",
            "resolve": {
                "retain": 1,
                "actions": [
                    {
                        "type": "reduce_item",
                        "id": "lingbaozhuangban_kuluomidewanpi",
                        "amount": 1
                    },
                    {
                        "type": "add_item",
                        "id": "sanliouduihuanbi",
                        "amount": 98
                    }
                ]
            }
        },
        "lingbaozhuangban_meiledidelingli":{
            "name":"灵宝装扮_美乐蒂的伶俐",
            "resolve": {
                "retain": 1,
                "actions": [
                    {
                        "type": "reduce_item",
                        "id": "lingbaozhuangban_meiledidelingli",
                        "amount": 1
                    },
                    {
                        "type": "add_item",
                        "id": "sanliouduihuanbi",
                        "amount": 98
                    }
                ]
            }
        },
        "lingbaozhuangban_daergoudenuannuan":{
            "name":"灵宝装扮_大耳狗的温暖",
            "resolve": {
                "retain": 1,
                "actions": [
                    {
                        "type": "reduce_item",
                        "id": "lingbaozhuangban_daergoudenuannuan",
                        "amount": 1
                    },
                    {
                        "type": "add_item",
                        "id": "sanliouduihuanbi",
                        "amount": 98
                    }
                ]
            }
        },
        "lingbaozhuangban_budinggoudeyouxian":{
            "name":"灵宝装扮_布丁狗的悠闲",
            "resolve": {
                "retain": 1,
                "actions": [
                    {
                        "type": "reduce_item",
                        "id": "lingbaozhuangban_budinggoudeyouxian",
                        "amount": 1
                    },
                    {
                        "type": "add_item",
                        "id": "sanliouduihuanbi",
                        "amount": 98
                    }
                ]
            }
        },
        "jifenduobaodiyongquan": {
            "name": "积分夺宝抵用券"
        },
        "pifusuipian": {
            "name": "皮肤碎片"
        },
        "dianbotonpinqinmidudaoju": {
            "name": "电波同频亲密度道具"
        },
        "gexingchuochuodaergouzhimeng": {
            "name": "个性戳戳大耳狗之梦"
        }
    },
    "pools": {
        "begin_pool": {
            "entries": [
                {
                    "probability": 0.001,
                    "actions": [
                        {
                            "type": "add_item",
                            "id": "yao_daergouzhimeng",
                            "amount": 1
                        }
                    ]
                },
                {
                    "probability": 0.001,
                    "actions": [
                        {
                            "type": "add_item",
                            "id": "anqila_kuluomizhixin",
                            "amount": 1
                        }
                    ]
                },
                {
                    "probability": 0.001,
                    "actions": [
                        {
                            "type": "add_item",
                            "id": "mianhuatangjuhuitianmu",
                            "amount": 1
                        }
                    ]
                },
                {
                    "probability": 0.368,
                    "actions": [
                        {
                            "type": "add_item",
                            "id": "sanliouduihuanbi",
                            "amount": 6
                        }
                    ]
                },
                {
                    "probability": 0.19,
                    "actions": [
                        {
                            "type": "add_item",
                            "id": "sanliouduihuanbi",
                            "amount": 16
                        }
                    ]
                },
                {
                    "probability": 0.074,
                    "actions": [
                        {
                            "type": "add_item",
                            "id": "sanliouduihuanbi",
                            "amount": 26
                        }
                    ]
                },
                {
                    "probability": 0.002,
                    "actions": [
                        {
                            "type": "add_item",
                            "id": "sanliouduihuanbi",
                            "amount": 66
                        }
                    ]
                },
                {
                    "probability": 0.08,
                    "actions": [
                        {
                            "type": "add_item",
                            "id": "jifenduobaodiyongquan",
                            "amount": 1
                        }
                    ]
                },
                {
                    "probability": 0.08,
                    "actions": [
                        {
                            "type": "add_item",
                            "id": "pifusuipian",
                            "amount": 6
                        }
                    ]
                },
                {
                    "probability": 0.1,
                    "actions": [
                        {
                            "type": "add_item",
                            "id": "dianbotonpinqinmidudaoju",
                            "amount": 2
                        }
                    ]
                },
                {
                    "probability": 0.1,
                    "actions": [
                        {
                            "type": "add_item",
                            "id": "gexingchuochuodaergouzhimeng",
                            "amount": 4
                        }
                    ]
                },
                {
                    "probability": 0.0006,
                    "actions": [
                        {
                            "type": "add_item",
                            "id": "lingbaozhuangban_kaidimaodetongqu",
                            "amount": 1
                        }
                    ]
                },
                {
                    "probability": 0.0006,
                    "actions": [
                        {
                            "type": "add_item",
                            "id": "lingbaozhuangban_kuluomidewanpi",
                            "amount": 1
                        }